{
  "task_id": "cowork-evo/xlsx-formula-authoring-order-margin",
  "rubric_version": "cowork-evo-rubric-v0.1",
  "pass_threshold": 0.8,
  "criteria": [
    {
      "id": "R001",
      "description": "必需交付文件 订单毛利计算.xlsx 全部存在，扩展名正确且可正常打开。",
      "weight": 2,
      "type": "hurdle",
      "dimension": "file_integrity",
      "method": "deterministic",
      "method_params": {
        "required_files": [
          "订单毛利计算.xlsx"
        ]
      },
      "score_cap_on_failure": 0
    },
    {
      "id": "R002",
      "description": "工作簿工作表、表头、行列结构和必要报告章节完整，与任务指定布局一致。",
      "weight": 2,
      "type": "positive",
      "dimension": "structure",
      "method": "deterministic",
      "method_params": {}
    },
    {
      "id": "R003",
      "description": "所有关键数字、分组汇总、去重结果与输入文件一致，数值误差不超过 0.01。",
      "weight": 4,
      "type": "positive",
      "dimension": "data_accuracy",
      "method": "deterministic",
      "method_params": {
        "numeric_tolerance": 0.01
      }
    },
    {
      "id": "R004",
      "description": "指定为动态计算的单元格使用正确、可编辑的 Excel 公式，引用范围正确。",
      "weight": 3,
      "type": "positive",
      "dimension": "data_accuracy",
      "method": "deterministic",
      "method_params": {}
    },
    {
      "id": "R005",
      "description": "表头、数字格式、冻结窗格、筛选、条件格式和可编辑图表符合任务的专业呈现要求。",
      "weight": 2,
      "type": "positive",
      "dimension": "presentation",
      "method": "deterministic",
      "method_params": {}
    },
    {
      "id": "R006",
      "description": "交付物没有空白工作表、断裂的图表数据源或 #REF!/#DIV/0! 等明显错误。",
      "weight": 1,
      "type": "positive",
      "dimension": "professional_standard",
      "method": "deterministic",
      "method_params": {}
    },
    {
      "id": "R007",
      "description": "如果交付物空白、擅自改动受保护的输入基础数据，或编造输入无法支持的关键事实，触发负向惩罚。",
      "weight": -4,
      "type": "penalty",
      "dimension": "factuality",
      "method": "deterministic",
      "method_params": {}
    }
  ]
}
